{
  "schema_version": "2026-05-21",
  "id": "baseline-resource-scope",
  "name": "Baseline resource scope policy",
  "version": "1.0.0",
  "policy_input_schema_version": "2026-05-20",
  "entrypoint": "data.caracal.authz.result",
  "rego_modules": ["policies/baseline.rego"],
  "parameters_schema": {
    "type": "object",
    "properties": {
      "require_step_up_for_write": {
        "type": "boolean"
      }
    }
  },
  "tests": [
    {
      "name": "allows scoped read",
      "input_fixture": "policy-input.sts.valid.json",
      "expected_decision": "allow"
    }
  ],
  "compatibility": {
    "caracal_min_version": "0.1.2"
  },
  "signing": {
    "required": true,
    "algorithm": "sigstore"
  }
}
